{
  "schema": 1,
  "provider": "XXX/example-stats",
  "country": "XXX",
  "generatedAt": "2026-04-20T09:30:00Z",
  "period": { "latest": 2025 },
  "origin": {
    "files": [
      {
        "name": "regions-2025.csv",
        "url": "https://stats.example.gov/household-survey/2025/regions.csv",
        "sha256": "3f0c9a1d5e7b2c4a6f8e0d1b3a5c7e9f1b3d5f7a9c1e3b5d7f9a1c3e5b7d9f1a",
        "retrievedAt": "2026-04-20"
      }
    ]
  },
  "values": {
    "region": {
      "XX-N": { "internet": 62.5, "water": 95, "poverty": 21.4, "unemployment": 6.2 },
      "XX-S": { "internet": 50, "water": 85, "poverty": 34.9, "unemployment": null }
    }
  }
}
