{
 "schema": 1,
 "provider": "gem",
 "country": "PER",
 "generatedAt": "2026-10-11T17:01:35.708Z",
 "period": {
  "latest": 2023,
  "aggregation": "regions: mean of the raster cells inside them; cities: the cell at their point"
 },
 "origin": {
  "files": [
   {
    "name": "v2023_1_pga_475_rock_3min.tif",
    "sha256": "c6928e0edea4d2a03e6a0d6b4aa9699159834f015c20ffb2d8ee8492ff67a5af",
    "retrievedAt": "2023-09-19"
   }
  ],
  "notes": "GEM Global Seismic Hazard Map v2023.1.0, PGA 475-year return period on rock, 3-arc-minute raster (zenodo.org/records/8409647, doi:10.5281/zenodo.8409647), downloaded 2026-10-11; CC BY-NC-SA 4.0. Licence: as published by GEM (check before redistributing)."
 },
 "values": {
  "region": {
   "PE-TAC": {
    "pga475": 0.647,
    "pga475Max": 0.747
   },
   "PE-MDD": {
    "pga475": 0.113,
    "pga475Max": 0.38
   },
   "PE-LOR": {
    "pga475": 0.172,
    "pga475Max": 0.559
   },
   "PE-AMA": {
    "pga475": 0.405,
    "pga475Max": 0.569
   },
   "PE-CAJ": {
    "pga475": 0.466,
    "pga475Max": 0.629
   },
   "PE-TUM": {
    "pga475": 0.734,
    "pga475Max": 0.806
   },
   "PE-PIU": {
    "pga475": 0.65,
    "pga475Max": 0.926
   },
   "PE-UCA": {
    "pga475": 0.215,
    "pga475Max": 0.508
   },
   "PE-PUN": {
    "pga475": 0.319,
    "pga475Max": 0.598
   },
   "PE-MOQ": {
    "pga475": 0.624,
    "pga475Max": 0.745
   },
   "PE-ARE": {
    "pga475": 0.63,
    "pga475Max": 0.765
   },
   "PE-ICA": {
    "pga475": 0.602,
    "pga475Max": 0.743
   },
   "PE-LIM": {
    "pga475": 0.555,
    "pga475Max": 0.605
   },
   "PE-CAL": {
    "pga475": 0.597,
    "pga475Max": 0.597
   },
   "PE-ANC": {
    "pga475": 0.477,
    "pga475Max": 0.627
   },
   "PE-LAL": {
    "pga475": 0.569,
    "pga475Max": 0.711
   },
   "PE-LAM": {
    "pga475": 0.607,
    "pga475Max": 0.84
   },
   "PE-CUS": {
    "pga475": 0.363,
    "pga475Max": 0.576
   },
   "PE-AYA": {
    "pga475": 0.493,
    "pga475Max": 0.671
   },
   "PE-APU": {
    "pga475": 0.494,
    "pga475Max": 0.562
   },
   "PE-HUV": {
    "pga475": 0.4,
    "pga475Max": 0.562
   },
   "PE-SAM": {
    "pga475": 0.439,
    "pga475Max": 0.515
   },
   "PE-HUC": {
    "pga475": 0.379,
    "pga475Max": 0.548
   },
   "PE-PAS": {
    "pga475": 0.447,
    "pga475Max": 0.57
   },
   "PE-JUN": {
    "pga475": 0.39,
    "pga475Max": 0.562
   }
  },
  "city": {
   "PER-lima": {
    "pga475": 0.585
   },
   "PER-callao": {
    "pga475": 0.597
   },
   "PER-arequipa": {
    "pga475": 0.594
   },
   "PER-trujillo": {
    "pga475": 0.667
   },
   "PER-chiclayo": {
    "pga475": 0.593
   },
   "PER-iquitos": {
    "pga475": 0.028
   },
   "PER-huancayo": {
    "pga475": 0.437
   },
   "PER-piura": {
    "pga475": 0.676
   },
   "PER-cusco": {
    "pga475": 0.443
   },
   "PER-chimbote": {
    "pga475": 0.62
   },
   "PER-pucallpa": {
    "pga475": 0.231
   },
   "PER-tacna": {
    "pga475": 0.687
   },
   "PER-ica": {
    "pga475": 0.621
   },
   "PER-juliaca": {
    "pga475": 0.343
   },
   "PER-ayacucho": {
    "pga475": 0.393
   },
   "PER-sullana": {
    "pga475": 0.708
   },
   "PER-huanuco": {
    "pga475": 0.354
   },
   "PER-chincha-alta": {
    "pga475": 0.591
   },
   "PER-cajamarca": {
    "pga475": 0.49
   },
   "PER-cerro-de-pasco": {
    "pga475": 0.337
   },
   "PER-puno": {
    "pga475": 0.355
   },
   "PER-tumbes": {
    "pga475": 0.729
   }
  }
 }
}
