{
 "schema": 1,
 "provider": "gem",
 "country": "URY",
 "generatedAt": "2026-10-11T17:01:20.557Z",
 "period": {
  "latest": 2023,
  "aggregation": "regions: mean of the raster cells inside them; cities: the cell at their point"
 },
 "origin": {
  "files": [
   {
    "name": "v2023_1_pga_475_rock_3min.tif",
    "sha256": "c6928e0edea4d2a03e6a0d6b4aa9699159834f015c20ffb2d8ee8492ff67a5af",
    "retrievedAt": "2023-09-19"
   }
  ],
  "notes": "GEM Global Seismic Hazard Map v2023.1.0, PGA 475-year return period on rock, 3-arc-minute raster (zenodo.org/records/8409647, doi:10.5281/zenodo.8409647), downloaded 2026-10-11; CC BY-NC-SA 4.0. Licence: as published by GEM (check before redistributing)."
 },
 "values": {
  "region": {
   "UY-PA": {
    "pga475": 0,
    "pga475Max": 0
   },
   "UY-AR": {
    "pga475": 0,
    "pga475Max": 0
   },
   "UY-SA": {
    "pga475": 0,
    "pga475Max": 0
   },
   "UY-RV": {
    "pga475": 0,
    "pga475Max": 0
   },
   "UY-RO": {
    "pga475": 0.002,
    "pga475Max": 0.007
   },
   "UY-TT": {
    "pga475": 0,
    "pga475Max": 0
   },
   "UY-CL": {
    "pga475": 0,
    "pga475Max": 0
   },
   "UY-MA": {
    "pga475": 0.004,
    "pga475Max": 0.007
   },
   "UY-CA": {
    "pga475": 0,
    "pga475Max": 0
   },
   "UY-MO": {
    "pga475": 0,
    "pga475Max": 0
   },
   "UY-SJ": {
    "pga475": 0,
    "pga475Max": 0
   },
   "UY-CO": {
    "pga475": 0,
    "pga475Max": 0
   },
   "UY-SO": {
    "pga475": 0,
    "pga475Max": 0
   },
   "UY-RN": {
    "pga475": 0,
    "pga475Max": 0
   },
   "UY-TA": {
    "pga475": 0,
    "pga475Max": 0
   },
   "UY-DU": {
    "pga475": 0,
    "pga475Max": 0
   },
   "UY-FS": {
    "pga475": 0,
    "pga475Max": 0
   },
   "UY-FD": {
    "pga475": 0,
    "pga475Max": 0
   },
   "UY-LA": {
    "pga475": 0,
    "pga475Max": 0
   }
  },
  "city": {
   "URY-montevideo": {
    "pga475": 0
   },
   "URY-rivera": {
    "pga475": 0
   },
   "URY-punta-del-este": {
    "pga475": 0.006
   },
   "URY-salto": {
    "pga475": 0
   }
  }
 }
}
